Competitor Name,Product Description,Marketing Strategy,Financial Summary
NovaTech,"Cloud-based productivity suite with AI writing, project tracking, and team dashboards.","Targets startups through freemium plans, creator partnerships, webinars, and fast onboarding campaigns.","Revenue is growing quickly, but profitability is limited because of high customer acquisition costs."
BrightDesk,"Customer service platform with chatbot automation, ticket routing, and analytics.","Focuses on mid-market businesses using case studies, LinkedIn ads, comparison pages, and customer success stories.","Stable recurring revenue with strong retention and moderate operating margins."
MarketPulse,"Competitive intelligence dashboard that tracks pricing, campaigns, and product launches.","Uses thought leadership, industry reports, SEO content, and enterprise sales outreach.","Enterprise contracts are increasing, but sales cycles are long and implementation costs are high."
FlowCart,"E-commerce operations tool for inventory forecasting, checkout optimization, and promotion planning.","Relies on influencer partnerships, Shopify marketplace listings, seasonal campaigns, and discount-led acquisition.","Revenue spikes during retail seasons, while churn remains a concern among smaller merchants."
SecureSync,"Data security and compliance platform for regulated teams.","Markets through trust-focused whitepapers, compliance webinars, partner channels, and direct sales to IT leaders.","High average contract value and healthy margins, but growth depends heavily on enterprise procurement cycles."
